<?xml version="1.0" encoding="UTF-8"?>
<Zahtev_za_unosenje_u_evidenciju_i_deponovanje_autorskih_dela xmlns="http://www.ftn.uns.ac.rs/patent"
 xmlns:xsi="http://www.w3.org/2001/XMLSchema-instance"
 xsi:schemaLocation="http://www.ftn.uns.ac.rs/patent file:/C:/Users/Lenovo/Desktop/XML/Projekat/XML-project/Schema/A_Sema.xsd">
    <Informacije_o_zahtevu>
        <Broj_prijave>
        </Broj_prijave>
        <Datum_podnosenja>
        </Datum_podnosenja>
        <Lista_priloga_koji_se_podnose_uz_zahtev>Lista_priloga_koji_se_podnose_uz_zahtev0</Lista_priloga_koji_se_podnose_uz_zahtev>
    </Informacije_o_zahtevu>
    <Sadrzaj_zahteva>
        <Podnosilac_zahteva xmlns:pat="http://www.ftn.uns.ac.rs/patent" xsi:type="pat:TFizickoLice">
            <Broj_telefona>+381 61234567</Broj_telefona>
            <Email>default@gmail.com</Email>
            <Drzavljanstvo>Drzavljanstvo0</Drzavljanstvo>
            <OsnovniLicniPodaci>
                <Ime>Ime0</Ime>
                <Prezime>Prezime0</Prezime>
                <Adresa>
                    <Ulica>Ulica0</Ulica>
                    <Broj_u_ulici>50</Broj_u_ulici>
                    <Postanski_broj>25500</Postanski_broj>
                    <Mesto>Mesto0</Mesto>
                    <Drzava>
                    </Drzava>
                </Adresa>
            </OsnovniLicniPodaci>
        </Podnosilac_zahteva>
        <Pseudonim_autora>Pseudonim_autora0</Pseudonim_autora>
        <Podaci_o_punomoćniku>
            <OsnovniLicniPodaci>
                <Ime>Ime1</Ime>
                <Prezime>Prezime1</Prezime>
                <Adresa>
                    <Ulica>Ulica1</Ulica>
                    <Broj_u_ulici>50</Broj_u_ulici>
                    <Postanski_broj>25500</Postanski_broj>
                    <Mesto>Mesto1</Mesto>
                    <Drzava>
                    </Drzava>
                </Adresa>
            </OsnovniLicniPodaci>
        </Podaci_o_punomoćniku>
        <Naslov_autorskog_dela>Naslov_autorskog_dela0</Naslov_autorskog_dela>
        <Naslov_i_autor_zasnivanog_dela>
        </Naslov_i_autor_zasnivanog_dela>
        <Vrsta_autorskog_dela>Vrsta_autorskog_dela0</Vrsta_autorskog_dela>
        <Forma_zapisa_autorskog_dela>Forma_zapisa_autorskog_dela0</Forma_zapisa_autorskog_dela>
        <Podaci_o_autoru>
        </Podaci_o_autoru>
        <Autosko_delo_stvoreno_u_radnom_odnosu>false</Autosko_delo_stvoreno_u_radnom_odnosu>
        <Nacin_koriscenja_autorskog_dela>Nacin_koriscenja_autorskog_dela0</Nacin_koriscenja_autorskog_dela>
    </Sadrzaj_zahteva>
</Zahtev_za_unosenje_u_evidenciju_i_deponovanje_autorskih_dela>
